{
  "irVersion": "0.1",
  "objective": "Evaluate a bounded XAUUSD risk decision using bundled non-live data",
  "assumptions": [
    "Bundled historical-style fixture; not live market data and not a trading recommendation"
  ],
  "inputs": {
    "prices": {
      "type": {"kind": "series", "element": {"kind": "number", "unit": "USD/oz"}},
      "value": [1980,1988,1974,1992,2001,1998,2010,2022,2018,2033,2040,2036,2052,2060,2056,2071,2068,2085,2094,2088,2101,2110,2106,2122,2130,2127,2142,2150,2146,2161],
      "provenance": {"source": "bundled-phase1-fixture", "contentHash": "4f5f77b44c4b55529e23c2d184e97f38f9ab94afba34a74b05d4788c607cc9fd"}
    },
    "equity": {
      "type": {"kind": "decimal", "unit": "USD", "scale": 2},
      "value": "100000.00",
      "provenance": {"source": "bundled-phase1-fixture", "contentHash": "a86d8cfc0a9b90e58e323c00dff1358c18c6cf67a694eb3a447ba065546982e2"}
    },
    "risk_fraction": {
      "type": {"kind": "decimal", "unit": "ratio", "scale": 6},
      "value": "0.005000",
      "provenance": {"source": "bundled-phase1-fixture", "contentHash": "56aa7d238f5dcc37b1b5a5ce290db87269870d7e73336242b5b76f3b95ae1e20"}
    },
    "loss_per_unit": {
      "type": {"kind": "decimal", "unit": "USD", "scale": 2},
      "value": "1500.00",
      "provenance": {"source": "bundled-phase1-fixture", "contentHash": "99d17e563509b26874408e6bd797317365b53d8bd26e2f8e0b8b91ab1d68fc55"}
    },
    "max_vol": {
      "type": {"kind": "number", "unit": "ratio"},
      "value": 0.3,
      "provenance": {"source": "bundled-phase1-fixture", "contentHash": "221764976efe04132774d96b0253cc31434c5261737469324f222621baf34b20"}
    },
    "cap": {
      "type": {"kind": "decimal", "unit": "units", "scale": 8},
      "value": "2.00000000",
      "provenance": {"source": "bundled-phase1-fixture", "contentHash": "d6cd40b3d72c5525d1a917ba30ad16ce68f1d3bb8d96f4283772e27375f357e6"}
    }
  },
  "nodes": [
    {"id":"returns","kind":"Transform","operation":"timeseries.returns","inputs":{"series":{"input":"prices"}}},
    {"id":"regression","kind":"Hypothesis","operation":"statistics.regression_index","inputs":{"series":{"input":"prices"}}},
    {"id":"zscore","kind":"Hypothesis","operation":"statistics.zscore_last","inputs":{"series":{"input":"prices"}}},
    {"id":"drawdown","kind":"Transform","operation":"finance.drawdown","inputs":{"series":{"input":"prices"}}},
    {"id":"vol","kind":"Transform","operation":"timeseries.rolling_volatility","inputs":{"returns":{"node":"returns"}},"params":{"window":10,"annualization":252}},
    {"id":"position","kind":"Optimize","operation":"finance.position_size","inputs":{"equity":{"input":"equity"},"risk_fraction":{"input":"risk_fraction"},"loss_per_unit":{"input":"loss_per_unit"}}},
    {"id":"capped_position","kind":"Optimize","operation":"optimization.min","inputs":{"value":{"node":"position"},"cap":{"input":"cap"}}},
    {"id":"vol_ok","kind":"Verify","operation":"comparison.lte","inputs":{"left":{"node":"vol"},"right":{"input":"max_vol"}}},
    {"id":"position_ok","kind":"Verify","operation":"comparison.lte","inputs":{"left":{"node":"capped_position"},"right":{"input":"cap"}}},
    {"id":"decision","kind":"Decision","operation":"logic.and","inputs":{"a":{"node":"vol_ok"},"b":{"node":"position_ok"}}}
  ],
  "constraints": [
    {"id":"risk-envelope","node":"decision","statement":"Volatility and position constraints must pass","severity":"error","expected":true}
  ],
  "decisionNodeId":"decision"
}
